{
 "schema_version": 1,
 "hospital_id": "rwjuh_nb",
 "name": "Robert Wood Johnson University Hospital, New Brunswick (model)",
 "disclaimer": "A model built from public information. Not affiliated with or endorsed by Robert Wood Johnson University Hospital. Patient flows, staffing and outcomes are simulated, not the hospital's operational data. Staff are fictional.",
 "version": 1,
 "site": {
  "w": 220,
  "d": 160,
  "roads": [
   {
    "id": "road-access",
    "label": "Access road",
    "width": 7,
    "points": [
     [
      0,
      139.0
     ],
     [
      220,
      139.0
     ]
    ],
    "provenance": "inferred"
   },
   {
    "id": "road-ambulance",
    "label": "Ambulance drive",
    "width": 6,
    "points": [
     [
      93.6,
      139.0
     ],
     [
      93.6,
      134.5
     ],
     [
      145.6,
      134.5
     ],
     [
      145.6,
      139.0
     ]
    ],
    "provenance": "inferred"
   },
   {
    "id": "road-dropoff",
    "label": "Walk-in drop-off",
    "width": 5,
    "points": [
     [
      43.0,
      139.0
     ],
     [
      43.0,
      125.0
     ],
     [
      59.0,
      125.0
     ],
     [
      59.0,
      139.0
     ]
    ],
    "provenance": "inferred"
   }
  ],
  "buildings": [
   {
    "id": "parking-deck",
    "label": "Parking deck",
    "height": 18,
    "polygon": [
     [
      4,
      70
     ],
     [
      32,
      70
     ],
     [
      32,
      124
     ],
     [
      4,
      124
     ]
    ],
    "provenance": "inferred",
    "source": "first-cut placeholder"
   },
   {
    "id": "childrens",
    "label": "Children's hospital",
    "height": 24,
    "polygon": [
     [
      160,
      62
     ],
     [
      214,
      62
     ],
     [
      214,
      112
     ],
     [
      160,
      112
     ]
    ],
    "provenance": "inferred",
    "source": "first-cut placeholder"
   },
   {
    "id": "cancer-institute",
    "label": "Cancer institute",
    "height": 24,
    "polygon": [
     [
      186,
      8
     ],
     [
      216,
      8
     ],
     [
      216,
      50
     ],
     [
      186,
      50
     ]
    ],
    "provenance": "inferred",
    "source": "first-cut placeholder"
   },
   {
    "id": "med-school",
    "label": "Medical education building",
    "height": 20,
    "polygon": [
     [
      4,
      8
     ],
     [
      32,
      8
     ],
     [
      32,
      56
     ],
     [
      4,
      56
     ]
    ],
    "provenance": "inferred",
    "source": "first-cut placeholder"
   }
  ]
 },
 "rooms": [
  {
   "id": "peds-01",
   "type": "peds_ed",
   "label": "Pediatric ED 1",
   "zone": "Pediatric ED",
   "x": 42.6,
   "z": 69.0,
   "w": 3.2,
   "d": 4.0,
   "floor": 0,
   "capacity": 1,
   "physical": true,
   "catalog_ref": "space/peds_ed",
   "provenance": "published",
   "source": "https://www.rwjbh.org/rwj-university-hospital-new-brunswick/treatment-care/emergency-services/ (separate pediatric emergency department; count assumed); exact position inferred",
   "note": "Separate pediatric emergency department is published; room count and position are assumed. Pediatric stream is not simulated in v1."
  },
  {
   "id": "peds-02",
   "type": "peds_ed",
   "label": "Pediatric ED 2",
   "zone": "Pediatric ED",
   "x": 46.0,
   "z": 69.0,
   "w": 3.2,
   "d": 4.0,
   "floor": 0,
   "capacity": 1,
   "physical": true,
   "catalog_ref": "space/peds_ed",
   "provenance": "published",
   "source": "https://www.rwjbh.org/rwj-university-hospital-new-brunswick/treatment-care/emergency-services/ (separate pediatric emergency department; count assumed); exact position inferred",
   "note": "Separate pediatric emergency department is published; room count and position are assumed. Pediatric stream is not simulated in v1."
  },
  {
   "id": "peds-03",
   "type": "peds_ed",
   "label": "Pediatric ED 3",
   "zone": "Pediatric ED",
   "x": 49.4,
   "z": 69.0,
   "w": 3.2,
   "d": 4.0,
   "floor": 0,
   "capacity": 1,
   "physical": true,
   "catalog_ref": "space/peds_ed",
   "provenance": "published",
   "source": "https://www.rwjbh.org/rwj-university-hospital-new-brunswick/treatment-care/emergency-services/ (separate pediatric emergency department; count assumed); exact position inferred",
   "note": "Separate pediatric emergency department is published; room count and position are assumed. Pediatric stream is not simulated in v1."
  },
  {
   "id": "peds-04",
   "type": "peds_ed",
   "label": "Pediatric ED 4",
   "zone": "Pediatric ED",
   "x": 52.8,
   "z": 69.0,
   "w": 3.2,
   "d": 4.0,
   "floor": 0,
   "capacity": 1,
   "physical": true,
   "catalog_ref": "space/peds_ed",
   "provenance": "published",
   "source": "https://www.rwjbh.org/rwj-university-hospital-new-brunswick/treatment-care/emergency-services/ (separate pediatric emergency department; count assumed); exact position inferred",
   "note": "Separate pediatric emergency department is published; room count and position are assumed. Pediatric stream is not simulated in v1."
  },
  {
   "id": "peds-05",
   "type": "peds_ed",
   "label": "Pediatric ED 5",
   "zone": "Pediatric ED",
   "x": 56.2,
   "z": 69.0,
   "w": 3.2,
   "d": 4.0,
   "floor": 0,
   "capacity": 1,
   "physical": true,
   "catalog_ref": "space/peds_ed",
   "provenance": "published",
   "source": "https://www.rwjbh.org/rwj-university-hospital-new-brunswick/treatment-care/emergency-services/ (separate pediatric emergency department; count assumed); exact position inferred",
   "note": "Separate pediatric emergency department is published; room count and position are assumed. Pediatric stream is not simulated in v1."
  },
  {
   "id": "peds-06",
   "type": "peds_ed",
   "label": "Pediatric ED 6",
   "zone": "Pediatric ED",
   "x": 59.6,
   "z": 69.0,
   "w": 3.2,
   "d": 4.0,
   "floor": 0,
   "capacity": 1,
   "physical": true,
   "catalog_ref": "space/peds_ed",
   "provenance": "published",
   "source": "https://www.rwjbh.org/rwj-university-hospital-new-brunswick/treatment-care/emergency-services/ (separate pediatric emergency department; count assumed); exact position inferred",
   "note": "Separate pediatric emergency department is published; room count and position are assumed. Pediatric stream is not simulated in v1."
  },
  {
   "id": "peds-07",
   "type": "peds_ed",
   "label": "Pediatric ED 7",
   "zone": "Pediatric ED",
   "x": 63.0,
   "z": 69.0,
   "w": 3.2,
   "d": 4.0,
   "floor": 0,
   "capacity": 1,
   "physical": true,
   "catalog_ref": "space/peds_ed",
   "provenance": "published",
   "source": "https://www.rwjbh.org/rwj-university-hospital-new-brunswick/treatment-care/emergency-services/ (separate pediatric emergency department; count assumed); exact position inferred",
   "note": "Separate pediatric emergency department is published; room count and position are assumed. Pediatric stream is not simulated in v1."
  },
  {
   "id": "peds-08",
   "type": "peds_ed",
   "label": "Pediatric ED 8",
   "zone": "Pediatric ED",
   "x": 66.4,
   "z": 69.0,
   "w": 3.2,
   "d": 4.0,
   "floor": 0,
   "capacity": 1,
   "physical": true,
   "catalog_ref": "space/peds_ed",
   "provenance": "published",
   "source": "https://www.rwjbh.org/rwj-university-hospital-new-brunswick/treatment-care/emergency-services/ (separate pediatric emergency department; count assumed); exact position inferred",
   "note": "Separate pediatric emergency department is published; room count and position are assumed. Pediatric stream is not simulated in v1."
  },
  {
   "id": "peds-09",
   "type": "peds_ed",
   "label": "Pediatric ED 9",
   "zone": "Pediatric ED",
   "x": 42.6,
   "z": 79.0,
   "w": 3.2,
   "d": 4.0,
   "floor": 0,
   "capacity": 1,
   "physical": true,
   "catalog_ref": "space/peds_ed",
   "provenance": "published",
   "source": "https://www.rwjbh.org/rwj-university-hospital-new-brunswick/treatment-care/emergency-services/ (separate pediatric emergency department; count assumed); exact position inferred",
   "note": "Separate pediatric emergency department is published; room count and position are assumed. Pediatric stream is not simulated in v1."
  },
  {
   "id": "peds-10",
   "type": "peds_ed",
   "label": "Pediatric ED 10",
   "zone": "Pediatric ED",
   "x": 46.0,
   "z": 79.0,
   "w": 3.2,
   "d": 4.0,
   "floor": 0,
   "capacity": 1,
   "physical": true,
   "catalog_ref": "space/peds_ed",
   "provenance": "published",
   "source": "https://www.rwjbh.org/rwj-university-hospital-new-brunswick/treatment-care/emergency-services/ (separate pediatric emergency department; count assumed); exact position inferred",
   "note": "Separate pediatric emergency department is published; room count and position are assumed. Pediatric stream is not simulated in v1."
  },
  {
   "id": "peds-11",
   "type": "peds_ed",
   "label": "Pediatric ED 11",
   "zone": "Pediatric ED",
   "x": 49.4,
   "z": 79.0,
   "w": 3.2,
   "d": 4.0,
   "floor": 0,
   "capacity": 1,
   "physical": true,
   "catalog_ref": "space/peds_ed",
   "provenance": "published",
   "source": "https://www.rwjbh.org/rwj-university-hospital-new-brunswick/treatment-care/emergency-services/ (separate pediatric emergency department; count assumed); exact position inferred",
   "note": "Separate pediatric emergency department is published; room count and position are assumed. Pediatric stream is not simulated in v1."
  },
  {
   "id": "peds-12",
   "type": "peds_ed",
   "label": "Pediatric ED 12",
   "zone": "Pediatric ED",
   "x": 52.8,
   "z": 79.0,
   "w": 3.2,
   "d": 4.0,
   "floor": 0,
   "capacity": 1,
   "physical": true,
   "catalog_ref": "space/peds_ed",
   "provenance": "published",
   "source": "https://www.rwjbh.org/rwj-university-hospital-new-brunswick/treatment-care/emergency-services/ (separate pediatric emergency department; count assumed); exact position inferred",
   "note": "Separate pediatric emergency department is published; room count and position are assumed. Pediatric stream is not simulated in v1."
  },
  {
   "id": "peds-13",